id;Sentence
1;to take a perfect route over the extras to stay in the time limit. </s><s> Not an arcade perfect conversion, but above average considering its time. </s><s> Not as innovative or offering as much longevity as other futuristic racing classics (e.g. Powerdrome), but
2;I took a look at the interior build quality. </s><s> By far the worst of any I've seen by a conversion company. </s><s> Pathetic actually, considering the price. </s><s> one of the guys in the club has a trailer like the one you pictured -> that's a sweet set up Pull the Jeep into the
3;"Department of Health issued a ""Holiday Travel Toolkit for Schools,"" which includes questions for Vermonters to consider before traveling, questions to ask of visitors before they make the trip and ways to develop alternative plans. </s><s> The"
4;. </s><s> The size of the country does not necessarily mean anything about the condition of roads, when no other factors are considered . </s><s> That's poor analytical thinking. </s><s> Do you not understand the relationship of population density to transportation? </s><s> A
5;","" Mr Speakman said. </s><s> NSW Labor said that as with the current Government, an incoming Daley Labor Government would consider the issues raised by the group after the election. </s><s> In the years before the royal commission into child abuse,"
6;are formed on a cycle of 20 – 29 weeks. </s><s> We've now passed the 29-week mark, so the situation temporarily favours the bulls. </s><s> Considering that a bullish divergence has appeared on the AO indicator (second window), when it crosses the zero line, the column's
7;ways? ... build on the positive psychology movement ... positive factors ... a more holistic approach ... it considers the context ... and the human needs ... more attention to the therapeutic relationship and individualization ... </s><s> [RNR
8;"the answer to that question will be yes. </s><s> BIGGER FISH TO FRY? </s><s> The inquiry was also told that the UK's Foreign Office didn't consider Saddam Hussein's Iraq to be the biggest threat to global security. </s><s> ""The inquiry was told that Iraq was ranked by the"
9;with dermatological emergencies and other type of medical emergencies could provide interesting information. </s><s> We consider that the results of this study firmly support the presence of on-call dermatologists to better attend dermatological
10;Aurora. </s><s> A Surprisingly Small Interior </s><s> The Aurora R10 chassis is moderately sized, and it could justify being bigger considering the power inside. </s><s> It measures 18.9 by 8.8 by 17 inches (HWD), so it's not too tall or deep, and it is thinner in the front and
11;, mental health, aged care or disability </s><s> Entry requirements </s><s> This course has been specially designed for anyone considering a career in the healthcare or community services industries, especially school leavers and career changers. </s><s> Visit
12;you've insulated, because hot air rises. </s><s> For the warmer months, a ceiling fan can help enhance your air conditioning. </s><s> Consider installing a separate thermostat to the loft Are you ready to add insulation into the attic? </s><s> This will typically be
13;technology is the poor survival of microorganisms during storage. </s><s> Liquid inoculants amended with polymers has considered as a solution to the problems associated with shorter shelf life and poor quality. </s><s> This study was conducted to improve
14;List. </s><s> One would think that a Jewish guy would be wary of government confiscating firearms from its citizens considering what happened to the Jews in Nazi Germany but Weinstein seems to live in the world he creates in movies. </s><s> Emily Miller
15;Even if we were to conclude that saliva and DNA have not been historically protected under article I, section 7, we must consider the extent to which persons' movements, associations, lifestyle, and other intimate details of their lives would be
16;making a donation? </s><s> If it doesn't, work on it until the appeal is very clear. </s><s> Hint: before omitting any key information, consider carefully whether that information should in fairness be disclosed to donors. </s><s> Nurture a culture of disclosure and
17;2015 such release had not happened at all. </s><s> There was also a story about a woman being released while her husband was not considered for release as he was arrested under the Terrorist and disruptive (Prevention) Act (TADA). </s><s> Vijayavani carried an
18;different types of steel bracing systems like X, V, K, Y systems were assigned. </s><s> These bracing systems were modeled by considering 3 different steel sections like Pipe section, angular section and multi section (pipe section for columns, angular
19;a member of the panel, was not asked to sign the final report. </s><s> He later stated that he would not have done so in any case. </s><s> He considered it unreasonable that the panel could come to a conclusion about UFOs in four days, when he himself had spent more than
20;"at an insurance company is going to go to her boss and ask for permission to exceed the Colossus determination of value? </s><s> Considering that her evaluation and merit pay will be based upon how ""efficiently"" (read that to mean cheaply, or ""hard-line"") she"
21;improvement. </s><s> Hence, the combination of amphotericin B and an azole antifungal, particularly fluconazole, may be considered in any case of disseminated coccidioidomycosis, particularly meningitis, where there is a clear lack of clinical
22;) or a DNA molecule, is immersed in an ionic solution, a process happens called screening or shielding. </s><s> Let's consider a negatively charged DNA molecule in an ionic salt solution. </s><s> Without the DNA molecule, the salt solution will have
23;"orders are required to be authenticated within seven days instead of 48 hours; </s><s> The ISDH clarifies that it does not consider COVID-19 deaths to be ""unusual"" for purposes of securing autopsies in cases of unusual deaths; </s><s> Hospitals may waive"
24;, we will use that space to project our images on the wall for customers to view. </s><s> There are far too many part-timers who consider themselves professional. </s><s> They haven't even learnt the basics. </s><s> They just pick up a digital camera and think they can go
25;with adequate training and resources, and making mitigation promises mandatory are all good ideas that should be considered and do not require amending NEPA or its regulations. </s><s> I strongly urge the Task Force to reconsider its recommendations. </s>
26;impacts to the new Ceylon and Cabin Bluff state wildlife management areas near the proposed launch site. </s><s> The FAA has not considered the proposed spaceport's impacts on those properties. </s><s> The Forsyth County Animal Shelter will waive adoption fee on
27;"circuitry. </s><s> The laser and plasma shield functioned at only fifty-seven parts per unit of fighting capacity, though he considered that it was sufficient for the following actions. </s><s> He ordered the gate to open again, then said, ""Hetan Sellon: come out."
28;collapse is how Dwight Howard is going about his business. </s><s> How about this: before you start pointing fingers at Dwight, consider who he's working with. </s><s> Ryan Anderson? </s><s> Solid young player, but not a second option. </s><s> Hedo Turkoglu? </s><s> Hasn't given a sh!t
29;"Interest/Arousal Disorder"" (p. 433). </s><s> The above 1839 reference to ""unbridled masturbation...that...ought to be considered [a] species of insanity"", can be contrasted with attitudes about masturbation today. </s><s> An article in a popular women's"
30;the 8 in. dia. </s><s> Aeromarine design for the US Navy could produce slightly more than 4 lbs., on auto gasoline. </s><s> Before I would consider buying one for use (as opposed to collecting, which I do,) I'd want to know the availability of parts, especially the
31;and perspicacious Watcher of Weasels </s><s> The Winners </s><s> Watchers Council </s><s> I was out of town (or out of my mind) this weekend, so consider this the late late edition (and quite abbreviated, alas) of the winners of the Watcher's Council trials. </s><s> Note that this
32;top of the 6 distinct amateur skill divisions, the skill differences at the Open level were so vast that I never really considered myself one of the true elite. </s><s> I've also taken numerous lessons in skiing and scuba diving. </s><s> As for my son's incident, I
33;airport to downtown Cebu runs less that $1.00 CAD. </s><s> Payment is in Philippine Pesos. </s><s> To give yourself more flexibility, consider a rental car. </s><s> There's plenty of island to explore. </s><s> Hotels in Cebu </s><s> Cebu City gives you the greatest number of hotel
34;"as a main-clause break. </s><s> For more on this, see ""Language as a Stream of Meaning."" </s><s> 7. </s><s> Most grammarians would probably consider ""earth"" to be the direct object of ""was burning"" and ""hard"" to be either an objective or subjective complement. </s><s> I can"
35;"own land on the Indonesian island of Sumatra. $ingapore's foreign minister said he had asked the attorney-general to consider the legal options. </s><s> However, he said it was mainly up to Indonesia to take action against the companies."" </s><s> - BBC (click"
36;that will support your business and keep your equipment secure, our Data Center Checklist outlines the key factors to consider when evaluating data centers and colocation. </s><s> Flexer's office to send them somewhere else. </s><s> Data Foundry offers fully
37;by women of alternative sexualities. </s><s> In Kazakhstan, the society accepts and values men who are savage and brutal. </s><s> It's considered natural when men make sexual advances towards women. </s><s> That's why it's no surprise that sexual harassment at the
38;starts (was before GUI opens previously) and GUI code thought JIT was always unavailable.. </s><s> Fixed in next beta. </s><s> Uhh. </s><s> Considering those INSANE RAM settings, the scheme of getting this in one contiguous chunk sounds like Mission Impossible! </s><s> Or you
39;to avoid any questions about the selection process, according to a senior FIFA official Reinhard Grindel. </s><s> Morocco is considered an underdog to the joint bid from the United States, Mexico and Canada, and the country's bid leaders have already
40;. </s><s> Scroll down to the bottom of this page to read previous issues of the Campaign Update. </s><s> Brawn: Qualifying race is worth considering </s><s> The German publication Auto Motor und Sport last week revealed that plans are being considered whereby the grid for a
41;is dominated by a group of scientists commercially linked to the oral cholera vaccines Dukoral and Shanchol. </s><s> Let us consider the composition of the 28 October 2009 Cholera Vaccine Working Group of the WHO that recommended the use of these
42;illustrates two further usages that are restricted to verbs of non-spoken communication. </s><s> The concluding discussion considers patterns in the distribution of complements and usages among verbs of non-spoken communication. </s><s> Keywords: Verb,
43;, it is a scientific theory. </s><s> It does not speak of the inner meaning of the existence of parallel worlds. </s><s> Science does not consider it to be its task to reflect on the meaning and the implications of parallel lives for our day-to-day lives. </s><s> What does the
44;has no official league policy on whether or not players are required to stand for the national anthem. </s><s> One option being considered : having each team decide, which doesn't seem like much of a policy at all. </s><s> Several other possibilities remain, from
45;"."" </s><s> If grace abound much more in comparison of sin, it is abundant grace indeed, as will easily be granted by any that shall consider how sin hath abounded, and doth in every soul. </s><s> Hence he is said to be able, and we are bid to expect that he should do for us,"""
46;"providing direct support/caregiver role with individuals with intellectual or developmental disabilities; also consider ABA technicians, Behavioral Therapists, Behavioral Interventionist, etc. </s><s> Successful clearance of local and/or"
47;, a lot of organizations struggle to create a remarkable and magnetic workplace culture, even though today's workers consider it as much as they consider salary and benefits. </s><s> Many companies offer similar perks and benefits, but those do not
48;public authority may include the costs of maintaining the information in its cost recovery charge to the requester was considered in East Sussex County Council v Information Commissioner EA/2013/0037. </s><s> The tribunal referred the decision to the
49;[ very briefly: non-linear relationship (inverted u-shape) between gdp and pollutant emissions ] it is not enough to consider the statistical significance and the signs of the coefficients of gdp and gdp squared, but it is necessary to consider
50;portfolio, but noted that was due to duration risks as rates rise and not on any profit concerns. </s><s> In mid-2018, it advised considering closing oil as a hedge as non-OPEC supply was set to grow. </s><s> In early 2019, J.P. Morgan said it expected U.S. Federal
51;of compulsory rotations, elective activities and clinical practice, over the 6-years course. </s><s> During the course are considered mandatory several internships, clinical activities in the form of tutorials, where practical activities are
52;"stresses the identification of the majority of Kurdish people as Muslims; thus the Islamic sharia law will be considered as one of the major sources for legislation making. </s><s> It is clear to the world that in those countries where sharia law is"
53;low VBAC rates. </s><s> This project is funded by the European Commission under FP7-HEALTH. </s><s> An enthography study that considered the structures and processes inherent in the transition between midwifery-led and obstetric-led care. </s><s> The study
54;at the center of this solution. </s><s> Organizations that leverage multiple open-source or proprietary testing tools must consider an Open Testing Platform to keep pace with Agile and enterprise DevOps initiatives. </s><s> What is an Open Testing Platform? </s>
55;"for the purposes of the 1948 Act when they turn 18"": paragraph 148. </s><s> (5) The factors that should be taken into account when considering ordinary residence for the purposes of the 1948 Act include:- </s><s> (b) ties with the authority in which the young person is"
56;, Janice Koch, Ph.D. Professor of Science Education Hofstra University President, ASTE 2007-2008 </s><s> A mineral considered important for restoring psychological balance, yet toxic if taken long term, in high amounts and in the wrong form. </s><s> The
57;"remixes considering those had more symphonic elements that continuouslly said ""HERE I AM!! </s><s> ROOOOOARR!"" </s><s> (especially considering recent entry from MMZ2, Cool Mind). </s><s> Yet, this song can be appreciated in the dynamic that it seems static but actually"
58;hosted its annual Women Judges Reception, an event celebrating women on the bench and encouraging women to consider a judicial career. </s><s> The reception took place at Whittier Law School in Costa Mesa with approximately 80 guests from the
59;good shortcuts: </s><s> Favorite folders (Ex. </s><s> Desktop, My Documents and other Special Folders). </s><s> Haibun Awards for 2014 </s><s> When considering the merits of a haibun, I keep several central elements in mind. </s><s> Interesting, evocative prose, and verse that
60;to. </s><s> While it all certainly depends on the pilot's preferences, the places discussed in this article are universally considered to be either the most dangerous to fly to or the most preferred at best. </s><s> Up in the Hebrides archipelago, which is located
61;"rejected it,"" Cornyn said Monday. </s><s> Penry, 44, may be spared regardless of the ruling because the Texas Legislature will consider a bill this winter barring the execution of mentally retarded killers. </s><s> The law would be retroactive, thus applying to"
62;[28] for database workload and POV-RAY[29] for rendering scene workload. </s><s> While our previous tests have only considered a single VM running in isolation, it is far more common for each server to run multiple VMs simultaneously. </s><s> As
63;through the program or SIU Medical Library. </s><s> Board Certification/exam fees and preparatory materials will not be considered . </s><s> Elective Away Rotation Expenses* </s><s> Must be an upcoming rotation, cannot be retroactive. </s><s> Rotation must be reviewed and
64;"a keyboard,"" Boyer writes, and yet the nurses and technicians who measure and chart the body's data are unequivocally considered care workers. </s><s> Boyer does not simply valorize this labor as feminine, and therefore radical; nor does she condemn it as"
65;"Thoughts. </s><s> Generally my posts come about two beats after the issue I am discussing has faded into the background. </s><s> I consider this a strength; journalism is the first draft of history, I'll aim for the first revision of history. </s><s> [...] </s><s> This is a pet"
66;"over ""add $352 billion to the national debt over that period."" </s><s> Certainly there are reasons why a Congressperson might consider the extra debt a worthwhile cost to pay for the perceived benefits of the bill. </s><s> However, the Colorado media should ask"
67;"I feel that way every time; beyond the civic duty, it's my way as a citizen to speak my mind. </s><s> Even in a safe state, it's only considered safe because enough citizens show up and vote. </s><s> People who give up and stay home are a pestilence, if you asked me. </s><s> What is"
68;that which is at all possible with anyone today. </s><s> To convey some intelligible idea of that disposition, let the point be considered that it was from good that they came to know truth, that is, from love they came to know anything of faith. </s><s> But when that
69;below average money, or even below whatever it is she earns, she probably would have (at least physchologically) considered that a strike against him. </s><s> And although women will always portray themselves as factoring in more things than looks, it
70;"desk, tapping glasses against her lips as she thought. </s><s> This had been a most surprising visit and not one that she'd ever considered receiving. </s><s> It opened all sorts of interesting possibilities. </s><s> ""Chad?"" </s><s> Dr. Aubry called out to the empty office. </s><s> A"
71;ignorant stereotype here_ is particularly silly. </s><s> It expresses the author's opinion, nothing else. </s><s> Oh good god! </s><s> I consider mywelf a pretty open minded, even left leaning person but this is nothing more than a second rate whinging diatribe. </s><s> '
72;into account. </s><s> Based on our usage so far this supply will last us a good while. </s><s> However at this price it'd be difficult to consider the cost worthwhile in Australia, where the price would be the same. </s><s> Lunch of Haggis </s><s> The idea to throw a BBQ for any
73;"holy soil. </s><s> The sage Rabbi Anan said ""To be buried in Israel is like being buried under the altar."" </s><s> [5][6][7] </s><s> Researchers consider that the concept of a land made holy by being the ""earthly dwelling of the God of Israel"" was present in Judaism at the"
74;. </s><s> It enables students to understand the policy making process, to analyse the roles of key health policy actors, and to consider the relationship between evidence and policy in relation to health. </s><s> Public health emphasises the dual objectives of
75;on the European system of harmonised standards. </s><s> The expert opinion, which was drafted on behalf of the Ministry, considers and assesses the current state of the European standardisation system and deals in particular with the implications
76;links: </s><s> If you buy those cards from reputable manufacturer (MSI, Asus etc.) the picture quality is often quite good. </s><s> Considering DOS compatibility I have yet to find a game that doesn't work with TNT2/Geforce 2. </s><s> Their DOS compatibility is great. </s><s> Do
77;and without diagnosis, treatment is delayed. </s><s> Smoking is the most important risk factor for COPD. </s><s> COPD should be considered in anyone over 35 years old with a smoking history or occupational exposures to dust or fumes. </s><s> Ensure you ask your
78;here and see the cover here. </s><s> Heidi's 10k run - Heidi is running the BUPA Great Manchester 10 km run for CRUK. </s><s> We hope you'll consider supporting her via JustGiving: https://www.justgiving.com/heidi-fisk. </s><s> Doctor Haitham - Well Done to Dr Haitham
79;because of the image given off by the undesirable new members. </s><s> Then again, it seems that at big campuses, chapters are considered struggling if they don't make quota no matter how awesome their new member classes are... so I think a lot of groups make
80;but it will also be added to all relevant web pages as tagged, included in the WPI Today email and fed to the WPI mobile app. </s><s> Consider sending a note to The Herd to get information about your event in front of the WPI community. </s><s> To submit a story idea, email
81;"Rerun: ""The Surrogate"" ? An overly enthusiastic Audrey pushes it too far with a surrogate mother who she and Jeff are considering paying to have their baby. </s><s> Meanwhile, Russell shamelessly pokes fun at Jennifer and Adam's wedding Web site, on a"
82;, in determining whether a statutory exclusion reasonably relates to the governmental purpose it is appropriate to consider the history and significance of the benefits denied. </s><s> See Glucksberg, 521 U.S. at 710, 117 S.Ct. 2258 (to assess
83;which they codified are thought to go back to the start of the 19th century. </s><s> Moreover, most of the Treaties that will be considered in this article, whether or not they have been ratified by the states at issue, by reason of their intention to have a
84;the world, and fostering thinking freely as rational and autonomous beings, among other things. </s><s> Stringer wraps up by considering whether anything indispensable to the good life is lost when we abandon traditional theistic belief for atheism,
85;off the subject – if you'd be hanged before dangling your poetic love proclamations from the ceiling, you might consider the subtler but still sexy choice of a Pound of Flesh. </s><s> No need to file a court order, Portia: this is a beautiful, bronze
86;already confusing situation. </s><s> I think it is right but I shall try to make it conventional without introducing errors. </s><s> We consider a central attractor at the origin whose mass is 1/(gravitational constant). </s><s> Actually we will assume units where that
87;with angioedema due to an ARB had a prior episode of angioedema attributed to an ACE inhibitor.[ </s><s> 31] ARBs should not be considered a safe alternative for patients who have experienced ACE inhibitor angioedema.[ </s><s> 19] The management of patients with
88;election costs and did not provide for simultaneous polling by district. </s><s> Challenged by Hume, he said he did not consider the government's corn resolutions a party matter, 31 Mar., but he was confident that their bill would 'protect the
89;<s> Abstract Should we give equal weight to all responses in a choice experiment? </s><s> Previous Choice Modelling papers have considered the issue of the internal consistency of choices – such as the extent to which strictly-dominated options are chosen. </s>
90;, and were in that sense alone acts of concealment. </s><s> This is not a realistic analysis of the statutory provisions. </s><s> I do not consider that the honest use of the protections afforded by the law, let alone their untested use, can be regarded as deliberate
91;, and want to express a deep appreciation to our trans colleagues (those who both have and have not shared in comments). </s><s> Considering this from the perspective of access to education for our members: keeping the Institute in NC excludes individual
92;translational action. </s><s> It would be fruitful for translation agencies at international, national, and local levels to consider adopting or adapting the commitments of CBS. </s><s> The commitments would certainly affect the translation brief and
93;<s> For anglo-saxon or non-European investors, the dominant role of the civil code in local business law must be carefully considered . </s><s> While for those who are familiar with civil code jurisdictions, it offers a perfectly workable and effective
94;in fact been compromised, their other accounts were then at risk for an attack as well. </s><s> Connect securely: You may want to consider using a VPN, or virtual private network, when connecting to public networks. </s><s> Those users who had signed into their
95;refractive index in quantum dot (QD) structures due to optical transitions from QD levels to continuum states is considered . </s><s> It is shown that, for large photon energies, the refractive index change is given asymptotically by the Drude formula
96;may report as the cost associated with establishing a particular clinical-community relationship. </s><s> Measure may consider various start-up costs including staff time, staff salaries, hiring costs, training time, technology
97;plants. </s><s> Shape of chromosome usually noted in anaphase. </s><s> Position of centromere or primary constriction is considered while determining shape of chromosome. </s><s> Chromosome types </s><s> Types of chromosome are listed on the basis of number of
